<?xml version="1.0" encoding="UTF-8" standalone="no"?>
<!DOCTYPE aeropuerto SYSTEM "aeropuerto.dtd">

<aeropuerto>
    <vuelo codigo="V22" estado="R">
        <origen> New York </origen>
        <destino> Chicago </destino>
        <hora_salida> 9:30 </hora_salida>
        <hora_llegada> 11:30 </hora_llegada>
        <diario/>
    </vuelo>

    <vuelo codigo="V23" estado="C">
        <origen> New York </origen>
        <destino> Miami </destino>
        <hora_salida> 10:15 </hora_salida>
        <hora_llegada> 11:15 </hora_llegada>
    </vuelo>
    <fecha> 20/12/2013 </fecha>
</aeropuerto>